id_anssi,type_bulletin,titre,date_publication,lien,nb_cve,cve_id,annee,cvss_score,cvss_severity,cvss_version,cwe_id,cwe_desc,description,vendor,product,versions,epss_score,epss_percentile,source,criticite,risque_combine
CERTFR-2025-ALE-002,Alerte,[MàJ] Vulnérabilité dans les produits Fortinet,2025-01-14,https://www.cert.ssi.gouv.fr/alerte/CERTFR-2025-ALE-002/,1,CVE-2024-55591,2025,9.6,CRITICAL,cvssV3_1,CWE-288,Execute unauthorized code or commands,An Authentication Bypass Using an Alternate Path or Channel vulnerability [CWE-288] affecting FortiOS version 7.0.0 through 7.0.16 and FortiProxy version 7.0.0 through 7.0.19 and 7.2.0 through 7.2.12 allows a remote attacker to gain super-admin privileges via crafted requests to Node.js websocket module.,Fortinet,FortiOS,7.0.0,0.94124,0.99916,zip,Critique,9.035904
CERTFR-2024-AVI-0434,Avis,Multiples vulnérabilités dans les produits Ivanti,2024-05-22,https://www.cert.ssi.gouv.fr/avis/CERTFR-2024-AVI-0434/,16,CVE-2024-29824,2024,9.6,CRITICAL,cvssV3_0,,,An unspecified SQL Injection vulnerability in Core server of Ivanti EPM 2022 SU5 and prior allows an unauthenticated attacker within the same network to execute arbitrary code.,Ivanti,EPM,2022 SU5,0.94089,0.999,zip,Critique,9.032544
CERTFR-2023-AVI-0306,Avis,Multiples vulnérabilités dans Microsoft Windows,2023-04-12,https://www.cert.ssi.gouv.fr/avis/CERTFR-2023-AVI-0306/,75,CVE-2023-21554,2023,9.8,CRITICAL,cvssV3_1,CWE-20,CWE-20: Improper Input Validation,Microsoft Message Queuing (MSMQ) Remote Code Execution Vulnerability,Microsoft,Windows 10 Version 1809,10.0.17763.0,0.92162,0.99696,zip,Critique,9.031876
CERTFR-2024-AVI-0958,Avis,Multiples vulnérabilités dans les produits IBM,2024-11-08,https://www.cert.ssi.gouv.fr/avis/CERTFR-2024-AVI-0958/,365,CVE-2024-21534,2024,9.8,CRITICAL,cvssV3_1,CWE-94,Remote Code Execution (RCE),"All versions of the package jsonpath-plus are vulnerable to Remote Code Execution (RCE) due to improper input sanitization. An attacker can execute aribitrary code on the system by exploiting the unsafe default usage of vm in Node.**Note:**There were several attempts to fix it in versions [10.0.0-10.1.0](https://github.com/JSONPath-Plus/JSONPath/compare/v9.0.0...v10.1.0) but it could still be exploited using [different payloads](https://github.com/JSONPath-Plus/JSONPath/issues/226).",,jsonpath-plus,0,0.91959,0.99681,zip,Critique,9.011982
CERTFR-2022-ALE-001,Alerte,[MaJ] Vulnérabilité dans Microsoft Windows,2022-01-12,https://www.cert.ssi.gouv.fr/alerte/CERTFR-2022-ALE-001/,1,CVE-2022-21907,2022,9.8,CRITICAL,cvssV3_1,,Remote Code Execution,HTTP Protocol Stack Remote Code Execution Vulnerability,Microsoft,Windows 10 Version 1809,10.0.17763.0,0.91887,0.99676,zip,Critique,9.004926000000001
CERTFR-2025-AVI-0239,Avis,Multiples vulnérabilités dans Microsoft Azure Kubernetes Service,2025-03-25,https://www.cert.ssi.gouv.fr/avis/CERTFR-2025-AVI-0239/,5,CVE-2025-1974,2025,9.8,CRITICAL,cvssV3_1,CWE-653,CWE-653 Improper Isolation or Compartmentalization,"A security issue was discovered in Kubernetes where under certain conditions, an unauthenticated attacker with access to the pod network can achieve arbitrary code execution in the context of the ingress-nginx controller. This can lead to disclosure of Secrets accessible to the controller. (Note that in the default installation, the controller can access all Secrets cluster-wide.)",kubernetes,ingress-nginx,"0, 1.12.0",0.91552,0.99653,zip,Critique,8.972096
CERTFR-2026-AVI-0143,Avis,Multiples vulnérabilités dans Synology Storage Manager,2026-02-11,https://www.cert.ssi.gouv.fr/avis/CERTFR-2026-AVI-0143/,2,CVE-2026-24061,2026,9.8,CRITICAL,cvssV3_1,CWE-88,CWE-88 Improper Neutralization of Argument Delimiters in a Command ('Argument Injection'),"telnetd in GNU Inetutils through 2.7 allows remote authentication bypass via a ""-f root"" value for the USER environment variable.",GNU,Inetutils,1.9.3,0.91526,0.99687,zip,Critique,8.969548
CERTFR-2022-ALE-003,Alerte,[MàJ] Vulnérabilité dans l'implémentation du protocole RPC par Microsoft,2022-04-13,https://www.cert.ssi.gouv.fr/alerte/CERTFR-2022-ALE-003/,1,CVE-2022-26809,2022,9.8,CRITICAL,cvssV3_1,,Remote Code Execution,Remote Procedure Call Runtime Remote Code Execution Vulnerability,Microsoft,Windows 10 Version 1809,10.0.17763.0,0.91426,0.99643,zip,Critique,8.959748000000001
CERTFR-2025-ALE-008,Alerte,[MàJ] Vulnérabilité dans Roundcube,2025-06-05,https://www.cert.ssi.gouv.fr/alerte/CERTFR-2025-ALE-008/,1,CVE-2025-49113,2025,9.9,CRITICAL,cvssV3_1,CWE-502,CWE-502 Deserialization of Untrusted Data,"Roundcube Webmail before 1.5.10 and 1.6.x before 1.6.11 allows remote code execution by authenticated users because the _from parameter in a URL is not validated in program/actions/settings/upload.php, leading to PHP Object Deserialization.",Roundcube,Webmail,"0, 1.6.0",0.90405,0.99584,zip,Critique,8.950095000000001
CERTFR-2025-AVI-0035,Avis,Multiples vulnérabilités dans Ivanti Endpoint Manager (EPM),2025-01-15,https://www.cert.ssi.gouv.fr/avis/CERTFR-2025-AVI-0035/,17,CVE-2024-13161,2025,9.8,CRITICAL,cvssV3_1,CWE-36,CWE-36 Absolute Path Traversal,Absolute path traversal in Ivanti EPM before the 2024 January-2025 Security Update and 2022 SU6 January-2025 Security Update allows a remote unauthenticated attacker to leak sensitive information.,Ivanti,Endpoint Manager,,0.9131,0.99635,zip,Critique,8.94838
CERTFR-2024-AVI-1028,Avis,Multiples vulnérabilités dans Zabbix,2024-11-29,https://www.cert.ssi.gouv.fr/avis/CERTFR-2024-AVI-1028/,14,CVE-2024-42327,2024,9.9,CRITICAL,cvssV3_1,CWE-89,CWE-89: SQL Injection,"A non-admin user account on the Zabbix frontend with the default User role, or with any other role that gives API access can exploit this vulnerability. An SQLi exists in the CUser class in the addRelatedObjects function, this function is being called from the CUser.get function which is available for every user who has API access.",Zabbix,Zabbix,"6.0.0, 6.4.0, 7.0.0",0.90296,0.99579,zip,Critique,8.939304
CERTFR-2023-AVI-0129,Avis,Multiples vulnérabilités dans Microsoft Office,2023-02-15,https://www.cert.ssi.gouv.fr/avis/CERTFR-2023-AVI-0129/,5,CVE-2023-21716,2023,9.8,CRITICAL,cvssV3_1,CWE-190,CWE-190: Integer Overflow or Wraparound,Microsoft Word Remote Code Execution Vulnerability,Microsoft,Microsoft Office LTSC for Mac 2021,16.0.1,0.91148,0.99627,zip,Critique,8.932504
CERTFR-2024-ALE-004,Alerte,[MàJ] Vulnérabilité dans Fortinet FortiOS,2024-02-09,https://www.cert.ssi.gouv.fr/alerte/CERTFR-2024-ALE-004/,1,CVE-2024-21762,2024,9.6,CRITICAL,cvssV3_1,CWE-787,Execute unauthorized code or commands,"A out-of-bounds write in Fortinet FortiOS versions 7.4.0 through 7.4.2, 7.2.0 through 7.2.6, 7.0.0 through 7.0.13, 6.4.0 through 6.4.14, 6.2.0 through 6.2.15, 6.0.0 through 6.0.17, FortiProxy versions 7.4.0 through 7.4.2, 7.2.0 through 7.2.8, 7.0.0 through 7.0.14, 2.0.0 through 2.0.13, 1.2.0 through 1.2.13, 1.1.0 through 1.1.6, 1.0.0 through 1.0.7 allows attacker to execute unauthorized code or commands via specifically crafted requests",Fortinet,FortiProxy,"7.4.0, 7.2.0, 7.0.0, 2.0.0, 1.2.0",0.9291,0.99762,zip,Critique,8.91936
CERTFR-2023-AVI-0051,Avis,Multiples vulnérabilités dans les produits Juniper,2023-01-23,https://www.cert.ssi.gouv.fr/avis/CERTFR-2023-AVI-0051/,229,CVE-2020-14871,2023,10.0,CRITICAL,cvssV3_1,,"Easily exploitable vulnerability allows unauthenticated attacker with network access via multiple protocols to compromise Oracle Solaris.  While the vulnerability is in Oracle Solaris, attacks may significantly impact additional products.  Successful attacks of this vulnerability can result in takeover of Oracle Solaris.","Vulnerability in the Oracle Solaris product of Oracle Systems (component: Pluggable authentication module). Supported versions that are affected are 10 and 11. Easily exploitable vulnerability allows unauthenticated attacker with network access via multiple protocols to compromise Oracle Solaris. While the vulnerability is in Oracle Solaris, attacks may significantly impact additional products. Successful attacks of this vulnerability can result in takeover of Oracle Solaris. Note: This CVE is not exploitable for Solaris 11.1 and later releases, and ZFSSA 8.7 and later releases, thus the CVSS Base Score is 0.0. CVSS 3.1 Base Score 10.0 (Confidentiality, Integrity and Availability impacts). CVSS Vector: (CVSS:3.1/AV:N/AC:L/PR:N/UI:N/S:C/C:H/I:H/A:H).",Oracle Corporation,Solaris Operating System,"10, 11",0.88872,0.995,zip,Critique,8.8872
CERTFR-2023-ALE-012,Alerte,[MàJ] Vulnérabilité dans Citrix NetScaler ADC et NetScaler Gateway,2023-10-23,https://www.cert.ssi.gouv.fr/alerte/CERTFR-2023-ALE-012/,1,CVE-2023-4966,2023,9.4,CRITICAL,cvssV3_1,CWE-119,CWE-119 Improper Restriction of Operations within the Bounds of a Memory Buffer,"Sensitive information disclosure in NetScaler ADC and NetScaler Gateway when configured as a Gateway (VPN virtual server, ICA Proxy, CVPN, RDP Proxy) or AAA  virtual server. 



",Citrix,NetScaler ADC ,"14.1, 13.1, 13.0, 13.1-FIPS, 12.1-FIPS",0.94348,0.99954,zip,Critique,8.868712
CERTFR-2024-AVI-0784,Avis,Vulnérabilité dans Ivanti Cloud Service Appliance,2024-09-17,https://www.cert.ssi.gouv.fr/avis/CERTFR-2024-AVI-0784/,2,CVE-2024-8963,2024,9.4,CRITICAL,cvssV3_1,CWE-22,CWE-22 Improper Limitation of a Pathname to a Restricted Directory ('Path Traversal'),Path Traversal in the Ivanti CSA before 4.6 Patch 519 allows a remote unauthenticated attacker to access restricted functionality.,Ivanti,CSA (Cloud Services Appliance),,0.94225,0.99919,zip,Critique,8.85715
CERTFR-2024-AVI-0106,Avis,Multiples vulnérabilités dans Fortinet FortiSIEM,2024-02-08,https://www.cert.ssi.gouv.fr/avis/CERTFR-2024-AVI-0106/,3,CVE-2024-23108,2024,9.7,CRITICAL,cvssV3_1,CWE-78,Execute unauthorized code or commands,An improper neutralization of special elements used in an os command ('os command injection') in Fortinet FortiSIEM version 7.1.0 through 7.1.1 and 7.0.0 through 7.0.2 and 6.7.0 through 6.7.8 and 6.6.0 through 6.6.3 and 6.5.0 through 6.5.2 and 6.4.0 through 6.4.2 allows attacker to execute unauthorized code or commands via via crafted API requests.,Fortinet,FortiSIEM,"7.1.0, 7.0.0, 6.7.0, 6.6.0, 6.5.0",0.91253,0.99631,zip,Critique,8.851541
CERTFR-2023-AVI-0939,Avis,Multiples vulnérabilités dans les produits Adobe,2023-11-15,https://www.cert.ssi.gouv.fr/avis/CERTFR-2023-AVI-0939/,23,CVE-2023-44353,2023,9.8,CRITICAL,cvssV3_1,CWE-502,Deserialization of Untrusted Data (CWE-502),Adobe ColdFusion versions 2023.5 (and earlier) and 2021.11 (and earlier) are affected by an Deserialization of Untrusted Data vulnerability that could result in Arbitrary code execution. Exploitation of this issue does not require user interaction.,Adobe,ColdFusion,0,0.90264,0.99576,zip,Critique,8.845872
CERTFR-2024-AVI-0899,Avis,Vulnérabilité dans Grafana,2024-10-18,https://www.cert.ssi.gouv.fr/avis/CERTFR-2024-AVI-0899/,1,CVE-2024-9264,2024,9.4,CRITICAL,cvssV4_0,CWE-94,CWE-94: Improper Control of Generation of Code ('Code Injection'),"The SQL Expressions experimental feature of Grafana allows for the evaluation of `duckdb` queries containing user input. These queries are insufficiently sanitized before being passed to `duckdb`, leading to a command injection and local file inclusion vulnerability. Any user with the VIEWER or higher permission is capable of executing this attack.  The `duckdb` binary must be present in Grafana's $PATH for this attack to function; by default, this binary is not installed in Grafana distributions.",Grafana,Grafana,"11.0.0, 11.1.0, 11.2.0, 11.0.0, 11.1.0",0.93989,0.99883,zip,Critique,8.834966
CERTFR-2024-AVI-0681,Avis,Multiples vulnérabilités dans Microsoft Windows,2024-08-14,https://www.cert.ssi.gouv.fr/avis/CERTFR-2024-AVI-0681/,65,CVE-2024-38063,2024,9.8,CRITICAL,cvssV3_1,CWE-191,CWE-191: Integer Underflow (Wrap or Wraparound),Windows TCP/IP Remote Code Execution Vulnerability,Microsoft,Windows 10 Version 1809,10.0.17763.0,0.89875,0.9955,zip,Critique,8.80775
CERTFR-2025-ALE-010,Alerte,[MàJ] Multiples vulnérabilités dans Microsoft SharePoint,2025-07-21,https://www.cert.ssi.gouv.fr/alerte/CERTFR-2025-ALE-010/,2,CVE-2025-53770,2025,9.8,CRITICAL,cvssV3_1,CWE-502,CWE-502: Deserialization of Untrusted Data,"Deserialization of untrusted data in on-premises Microsoft SharePoint Server allows an unauthorized attacker to execute code over a network.
Microsoft is aware that an exploit for CVE-2025-53770 exists in the wild.
Microsoft is preparing and fully testing a comprehensive update to address this vulnerability.  In the meantime, please make sure that the mitigation provided in this CVE documentation is in place so that you are protected from exploitation.",Microsoft,Microsoft SharePoint Enterprise Server 2016,16.0.0,0.89607,0.99536,zip,Critique,8.781486000000001
CERTFR-2023-AVI-0970,Avis,Multiples vulnérabilités dans les produits OwnCloud,2023-11-22,https://www.cert.ssi.gouv.fr/avis/CERTFR-2023-AVI-0970/,3,CVE-2023-49105,2023,9.8,CRITICAL,cvssV3_1,,,"An issue was discovered in ownCloud owncloud/core before 10.13.1. An attacker can access, modify, or delete any file without authentication if the username of a victim is known, and the victim has no signing-key configured. This occurs because pre-signed URLs can be accepted even when no signing-key is configured for the owner of the files. The earliest affected version is 10.6.0.",,,,0.89605,0.99536,zip,Critique,8.78129
CERTFR-2024-ALE-015,Alerte,[MàJ] Multiples vulnérabilités sur l'interface d'administration des équipements Palo Alto Networks,2024-11-15,https://www.cert.ssi.gouv.fr/alerte/CERTFR-2024-ALE-015/,2,CVE-2024-0012,2024,9.3,CRITICAL,cvssV4_0,CWE-306,CWE-306 Missing Authentication for Critical Function,"An authentication bypass in Palo Alto Networks PAN-OS software enables an unauthenticated attacker with network access to the management web interface to gain PAN-OS administrator privileges to perform administrative actions, tamper with the configuration, or exploit other authenticated privilege escalation vulnerabilities like  CVE-2024-9474 https://security.paloaltonetworks.com/CVE-2024-9474 .

The risk of this issue is greatly reduced if you secure access to the management web interface by restricting access to only trusted internal IP addresses according to our recommended  best practice deployment guidelines https://live.paloaltonetworks.com/t5/community-blogs/tips-amp-tricks-how-to-secure-the-management-access-of-your-palo/ba-p/464431 .

This issue is applicable only to PAN-OS 10.2, PAN-OS 11.0, PAN-OS 11.1, and PAN-OS 11.2 software.

Cloud NGFW and Prisma Access are not impacted by this vulnerability.",Palo Alto Networks,Cloud NGFW,,0.943,0.99939,zip,Critique,8.7699
CERTFR-2024-AVI-0212,Avis,Multiples vulnérabilités dans les produits Fortinet,2024-03-13,https://www.cert.ssi.gouv.fr/avis/CERTFR-2024-AVI-0212/,9,CVE-2023-48788,2024,9.3,CRITICAL,cvssV3_1,CWE-89,Execute unauthorized code or commands,"A improper neutralization of special elements used in an sql command ('sql injection') in Fortinet FortiClientEMS version 7.2.0 through 7.2.2, FortiClientEMS 7.0.1 through 7.0.10 allows attacker to execute unauthorized code or commands via specially crafted packets.",Fortinet,FortiClientEMS,"7.2.0, 7.0.1",0.9416,0.99909,zip,Critique,8.75688
CERTFR-2022-ALE-012,Alerte,[MàJ] Vulnérabilité dans FortiOS SSL-VPN,2022-12-13,https://www.cert.ssi.gouv.fr/alerte/CERTFR-2022-ALE-012/,1,CVE-2022-42475,2022,9.3,CRITICAL,cvssV3_1,CWE-197,Execute unauthorized code or commands,"A heap-based buffer overflow vulnerability [CWE-122] in FortiOS SSL-VPN 7.2.0 through 7.2.2, 7.0.0 through 7.0.8, 6.4.0 through 6.4.10, 6.2.0 through 6.2.11, 6.0.15 and earlier  and FortiProxy SSL-VPN 7.2.0 through 7.2.1, 7.0.7 and earlier may allow a remote unauthenticated attacker to execute arbitrary code or commands via specifically crafted requests.",Fortinet,FortiProxy,"7.2.0, 7.0.0, 2.0.0, 1.2.0, 1.1.0",0.94005,0.99886,zip,Critique,8.742465000000001
CERTFR-2024-AVI-0859,Avis,Multiples vulnérabilités dans les produits Palo Alto Networks,2024-10-10,https://www.cert.ssi.gouv.fr/avis/CERTFR-2024-AVI-0859/,25,CVE-2024-9465,2024,9.2,CRITICAL,cvssV4_0,CWE-89,CWE-89 Improper Neutralization of Special Elements used in an SQL Command ('SQL Injection'),"An SQL injection vulnerability in Palo Alto Networks Expedition allows an unauthenticated attacker to reveal Expedition database contents, such as password hashes, usernames, device configurations, and device API keys. With this, attackers can also create and read arbitrary files on the Expedition system.",Palo Alto Networks,Expedition,1.2.0,0.94286,0.99934,zip,Critique,8.674312
CERTFR-2026-AVI-0099,Avis,Multiples vulnérabilités dans SolarWinds Web Help Desk,2026-01-28,https://www.cert.ssi.gouv.fr/avis/CERTFR-2026-AVI-0099/,6,CVE-2025-40551,2026,9.8,CRITICAL,cvssV3_1,CWE-502,CWE-502 Deserialization of Untrusted Data,"SolarWinds Web Help Desk was found to be susceptible to an untrusted data deserialization vulnerability that could lead to remote code execution, which would allow an attacker to run commands on the host machine. This could be exploited without authentication.",SolarWinds,Web Help Desk,12.8.8 HF1 and below,0.87872,0.99493,zip,Critique,8.611456
CERTFR-2024-AVI-1069,Avis,Multiples vulnérabilités dans Microsoft Windows,2024-12-11,https://www.cert.ssi.gouv.fr/avis/CERTFR-2024-AVI-1069/,59,CVE-2024-49112,2024,9.8,CRITICAL,cvssV3_1,CWE-190,CWE-190: Integer Overflow or Wraparound,Windows Lightweight Directory Access Protocol (LDAP) Remote Code Execution Vulnerability,Microsoft,Windows 10 Version 1809,10.0.17763.0,0.87774,0.99445,zip,Critique,8.601852000000001
CERTFR-2024-AVI-0500,Avis,Multiples vulnérabilités dans Elastic Kibana,2024-06-17,https://www.cert.ssi.gouv.fr/avis/CERTFR-2024-AVI-0500/,4,CVE-2024-3094,2024,10.0,CRITICAL,cvssV3_1,CWE-506,Embedded Malicious Code,"Malicious code was discovered in the upstream tarballs of xz, starting with version 5.6.0. 
Through a series of complex obfuscations, the liblzma build process extracts a prebuilt object file from a disguised test file existing in the source code, which is then used to modify specific functions in the liblzma code. This results in a modified liblzma library that can be used by any software linked against this library, intercepting and modifying the data interaction with this library.",,,"5.6.0, 5.6.1",0.85995,0.99365,zip,Critique,8.599499999999999
CERTFR-2024-ALE-001,Alerte,[MàJ] Multiples vulnérabilités dans Ivanti Connect Secure et Policy Secure Gateways,2024-01-11,https://www.cert.ssi.gouv.fr/alerte/CERTFR-2024-ALE-001/,5,CVE-2024-21887,2024,9.1,CRITICAL,cvssV3_0,,,"A command injection vulnerability in web components of Ivanti Connect Secure (9.x, 22.x) and Ivanti Policy Secure (9.x, 22.x)  allows an authenticated administrator to send specially crafted requests and execute arbitrary commands on the appliance.",Ivanti,ICS,"9.1R18, 22.6R2",0.94412,0.99977,zip,Critique,8.591491999999999
CERTFR-2021-ALE-004,Alerte,[MàJ] Multiples vulnérabilités dans Microsoft Exchange Server,2021-03-03,https://www.cert.ssi.gouv.fr/alerte/CERTFR-2021-ALE-004/,7,CVE-2021-26855,2021,9.1,CRITICAL,cvssV3_1,,Remote Code Execution,Microsoft Exchange Server Remote Code Execution Vulnerability,Microsoft,Microsoft Exchange Server 2016 Cumulative Update 19,15.01.0,0.94351,0.99955,zip,Critique,8.585941
CERTFR-2024-AVI-0714,Avis,Vulnérabilité dans SolarWinds Web Help Desk,2024-08-23,https://www.cert.ssi.gouv.fr/avis/CERTFR-2024-AVI-0714/,1,CVE-2024-28987,2024,9.1,CRITICAL,cvssV3_1,CWE-798,CWE-798 Use of Hard-coded Credentials,"The SolarWinds Web Help Desk (WHD) software is affected by a hardcoded credential vulnerability, allowing remote unauthenticated user to access internal functionality and modify data.",SolarWinds,Web Help Desk,12.8.3 Hotfix 1 and previous versions,0.9429,0.99935,zip,Critique,8.58039
CERTFR-2021-ALE-017,Alerte,Multiples vulnérabilités dans Microsoft Exchange,2021-08-27,https://www.cert.ssi.gouv.fr/alerte/CERTFR-2021-ALE-017/,3,CVE-2021-34473,2021,9.1,CRITICAL,cvssV3_1,,Remote Code Execution,Microsoft Exchange Server Remote Code Execution Vulnerability,Microsoft,Microsoft Exchange Server 2013 Cumulative Update 23,15.00.0,0.9423,0.99921,zip,Critique,8.57493
CERTFR-2023-AVI-0597,Avis,Multiples vulnérabilités dans IBM Cognos Analytics,2023-07-28,https://www.cert.ssi.gouv.fr/avis/CERTFR-2023-AVI-0597/,20,CVE-2022-36067,2023,10.0,CRITICAL,cvssV3_1,CWE-913,CWE-913: Improper Control of Dynamically-Managed Code Resources,"vm2 is a sandbox that can run untrusted code with whitelisted Node's built-in modules. In versions prior to version 3.9.11, a threat actor can bypass the sandbox protections to gain remote code execution rights on the host running the sandbox. This vulnerability was patched in the release of version 3.9.11 of vm2. There are no known workarounds.",patriksimek,vm2,< 3.9.11,0.85411,0.99333,zip,Critique,8.5411
CERTFR-2024-AVI-0557,Avis,Multiples vulnérabilités dans Microsoft Windows,2024-07-10,https://www.cert.ssi.gouv.fr/avis/CERTFR-2024-AVI-0557/,87,CVE-2024-38077,2024,9.8,CRITICAL,cvssV3_1,CWE-122,CWE-122: Heap-based Buffer Overflow,Windows Remote Desktop Licensing Service Remote Code Execution Vulnerability,Microsoft,Windows Server 2019,10.0.17763.0,0.87069,0.99416,zip,Critique,8.532762
CERTFR-2023-AVI-0227,Avis,Multiples vulnérabilités dans les produits Adobe,2023-03-15,https://www.cert.ssi.gouv.fr/avis/CERTFR-2023-AVI-0227/,7,CVE-2023-26359,2023,9.8,CRITICAL,cvssV3_1,CWE-502,Deserialization of Untrusted Data (CWE-502),Adobe ColdFusion versions 2018 Update 15 (and earlier) and 2021 Update 5 (and earlier) are affected by a Deserialization of Untrusted Data vulnerability that could result in arbitrary code execution in the context of the current user. Exploitation of this issue does not require user interaction.,Adobe,ColdFusion,"unspecified, unspecified",0.86789,0.99401,zip,Critique,8.505322000000001
CERTFR-2021-ALE-015,Alerte,Multiples vulnérabilités dans SolarWinds Serv-U,2021-07-13,https://www.cert.ssi.gouv.fr/alerte/CERTFR-2021-ALE-015/,1,CVE-2021-35211,2021,9.0,CRITICAL,cvssV3_1,,Memory Escape Vulnerability in Solarwinds Serv-U,"Microsoft discovered a remote code execution (RCE) vulnerability in the SolarWinds Serv-U product utilizing a Remote Memory Escape Vulnerability. If exploited, a threat actor may be able to gain privileged access to the machine hosting Serv-U Only. SolarWinds Serv-U Managed File Transfer and Serv-U Secure FTP for Windows before 15.2.3 HF2 are affected by this vulnerability.",SolarWinds,Serv-U Managed File Transfer Server and Serv-U Secured FTP,SolarWinds Serv-U,0.94321,0.99946,zip,Critique,8.48889
CERTFR-2025-ALE-001,Alerte,[MàJ] Vulnérabilité dans les produits Ivanti,2025-01-09,https://www.cert.ssi.gouv.fr/alerte/CERTFR-2025-ALE-001/,2,CVE-2025-0282,2025,9.0,CRITICAL,cvssV3_1,CWE-121,CWE-121: Stack-based Buffer Overflow,"A stack-based buffer overflow in Ivanti Connect Secure before version 22.7R2.5, Ivanti Policy Secure before version 22.7R1.2, and Ivanti Neurons for ZTA gateways before version 22.7R2.3 allows a remote unauthenticated attacker to achieve remote code execution.",Ivanti,Connect Secure,22.7R2,0.94129,0.99916,zip,Critique,8.47161
CERTFR-2024-AVI-0567,Avis,Multiples vulnérabilités dans les produits Palo Alto Networks,2024-07-11,https://www.cert.ssi.gouv.fr/avis/CERTFR-2024-AVI-0567/,5,CVE-2024-5910,2024,9.3,CRITICAL,cvssV4_0,CWE-306,CWE-306 Missing Authentication for Critical Function,"Missing authentication for a critical function in Palo Alto Networks Expedition can lead to an Expedition admin account takeover for attackers with network access to Expedition.

Note: Expedition is a tool aiding in configuration migration, tuning, and enrichment. Configuration secrets, credentials, and other data imported into Expedition is at risk due to this issue.",Palo Alto Networks,Expedition,1.2,0.91029,0.99618,zip,Critique,8.465697
CERTFR-2021-ALE-017,Alerte,Multiples vulnérabilités dans Microsoft Exchange,2021-08-27,https://www.cert.ssi.gouv.fr/alerte/CERTFR-2021-ALE-017/,3,CVE-2021-34523,2021,9.0,CRITICAL,cvssV3_1,,Elevation of Privilege,Microsoft Exchange Server Elevation of Privilege Vulnerability,Microsoft,Microsoft Exchange Server 2013 Cumulative Update 23,15.00.0,0.93998,0.99885,zip,Critique,8.45982
CERTFR-2024-AVI-0563,Avis,Multiples vulnérabilités dans les produits Citrix,2024-07-10,https://www.cert.ssi.gouv.fr/avis/CERTFR-2024-AVI-0563/,9,CVE-2024-6235,2024,9.4,CRITICAL,cvssV4_0,,,Sensitive information disclosure in NetScaler Console,NetScaler,NetScaler Console,14.1,0.89928,0.99554,zip,Critique,8.453232
CERTFR-2025-AVI-0337,Avis,Multiples vulnérabilités dans les produits IBM,2025-04-18,https://www.cert.ssi.gouv.fr/avis/CERTFR-2025-AVI-0337/,69,CVE-2025-1302,2025,9.8,CRITICAL,cvssV3_1,CWE-94,Remote Code Execution (RCE),"Versions of the package jsonpath-plus before 10.3.0 are vulnerable to Remote Code Execution (RCE) due to improper input sanitization. An attacker can execute aribitrary code on the system by exploiting the unsafe default usage of eval='safe' mode.**Note:**This is caused by an incomplete fix for [CVE-2024-21534](https://security.snyk.io/vuln/SNYK-JS-JSONPATHPLUS-7945884).",,jsonpath-plus,0,0.85805,0.99352,zip,Critique,8.40889
CERTFR-2022-ALE-007,Alerte,Multiples vulnérabilités dans Microsoft Windows,2022-09-16,https://www.cert.ssi.gouv.fr/alerte/CERTFR-2022-ALE-007/,3,CVE-2022-34718,2022,9.8,CRITICAL,cvssV3_1,,Remote Code Execution,Windows TCP/IP Remote Code Execution Vulnerability,Microsoft,Windows 10 Version 1809,10.0.17763.0,0.85781,0.99349,zip,Critique,8.406538
